PK;NOMBRE;DESCRIPCION-ENTIDAD;HORARIO;EQUIPAMIENTO;TRANSPORTE;DESCRIPCION;ACCESIBILIDAD;CONTENT-URL;NOMBRE-VIA;CLASE-VIAL;TIPO-NUM;NUM;PLANTA;PUERTA;ESCALERAS;ORIENTACION;LOCALIDAD;PROVINCIA;CODIGO-POSTAL;COD-BARRIO;BARRIO;COD-DISTRITO;DISTRITO;COORDENADA-X;COORDENADA-Y;LATITUD;LONGITUD;TELEFONO;FAX;EMAIL;TIPO
12424;"Mercado municipal de Alto de Extremadura";"En el Mercado de Alto de Extremadura cualquier ocasión es buena para acercarse (y acercar) a los vecinos: un partido de fútbol o el día del patrón, la inminencia del año nuevo o la celebración de un aniversario. La vida se renueva cada día en este mercado, abierto al público en 1974 y renovado en 2011, que combina la oferta tradicional de productos frescos, variantes y ultramarinos en puestos especializados con el servicio de un supermercado de medianas dimensiones. La veteranía y la confianza -comercio de cercanía- son aquí una constante, que cristaliza durante los fines de semana en degustaciones de platos de auténtica cocina de mercado: paella de campo o callos a la madrileña. Ubicado en el Paseo de los Jesuitas -muchos lo conocen todavía como &amp;ldquo;el mercado de los Jesuitas&amp;rdquo;- su área de influencia desborda los límites del barrio de Puerta del Ángel y se extiende a lo largo del Paseo de Extremadura. Este mercado abrió sus puertas por vez primera en junio de 1974 y tras 37 años de actividad se reinaugura en 2.011 para ofrecer a sus clientes la calidad, el servicio y el saber hacer de sus comercios típicos en un mercado tradicional, pero en un espacio renovado. Entre sus 26 puestos podrán encontrar distintos preparados y embutidos en carnes y pollos, chacinas regionales e ibéricas, frutas cortadas y en zumo, carnes exóticas, legumbres y encurtidos a granel directos del productor, productos extranjeros, carnes con denominación de orígen, podrá arreglar sus zapatos y duplicar sus llaves, todo ello tomándose un café en nuestra cafetería.";"Invierno:  De lunes a viernes: de 9 a 14 y de 17 a 20:30 horas. Sábados: de 9 a 14 horas.    Verano:  De lunes a viernes: de 9 a 14 y de 17:30 a 20:30 horas. Sábados: de 9 a 14:30 horas.    Supermercado Carrefour Express:  De lunes a sábado: de 9:30 a 22 horas. Festivos: de 10 a 15 horas.";"Dispone de wifi gratuita";"Metro: Alto de Extremadura (línea 6)  Bus: 31, 33, 36, 39, 65, 119, 138";"";"1";"http://www.madrid.es/sites/v/index.jsp?vgnextchannel=bfa48ab43d6bb410VgnVCM100000171f5a0aRCRD&vgnextoid=75e4e1635561c010VgnVCM1000000b205a0aRCRD";"JESUITAS";"PASEO";"V";"44";"";"";"";"";"MADRID";"MADRID";"28011";"2";"PUERTA DEL ANGEL";"10";"LATINA";"437622";"4473300";"40.40797174906472";"-3.7351687013396324";"914 794 751";"";"info@mercadoaltoextremadura.es";"/contenido/entidadesYorganismos/Comercios/Mercados"
12418;"Mercado municipal de Antón Martín";"Del techo desciende el taconeo de la escuela de arte flamenco y del suelo ascienden los golpes de las carretillas que traen y llevan género. Entre una cosa y otra, se abre paso una amplia oferta de ocio y restauración que se complementa -dialoga- con los puestos del mercado tradicional: carnicerías y pollerías, verdulerías y fruterías y pescaderías que sirven fuera y dentro del mercado. El mercado de Antón Martín es un trasiego de gente que compra, de gente que se sienta a comer y de gente que se lo lleva a casa. Aunque el mercado, tal y como lo conocemos hoy, se abrió al público en 1941, hace más de trescientos años que se vende comida en la plaza de Antón Martín. Asomado a la calle Atocha, con un ojo puesto en el Barrio de las Letras y otro en Lavapiés, presenta una imagen en constante renovación -fachada intervenida por enormes grafitis- que se corresponde con lo que hay dentro: actividad permanente alrededor de la comida, ya sea un plato de ostras, media docena de croquetas de autor o kilo y medio de calabacines. Inaugurado en el año 1941, el mercado de Antón Martín, situado en el barrio de Embajadores, junto al Cine Doré, sede de la Filmoteca Española, cuenta con más de 80 locales, entre puestos interiores y tiendas exteriores.";"Establecimientos del mercado tradicional:  de lunes a viernes de 9 a 21 horas y sábados de 9 a 15 horas.  Horario de restaruación: de lunes a viernes de 9 a 23:30 horas. Sábado de 15 a 18 horas (acceso por Duque de Fernán Núñez)";"Zona Wifi";"Metro: Anton Martin (línea 1)  Bus: 6, 26, 32";"";"1";"http://www.madrid.es/sites/v/index.jsp?vgnextchannel=bfa48ab43d6bb410VgnVCM100000171f5a0aRCRD&vgnextoid=cb05e1635561c010VgnVCM1000000b205a0aRCRD";"SANTA ISABEL";"CALLE";"V";"5";"";"";"";"";"MADRID";"MADRID";"28012";"2";"EMBAJADORES";"1";"CENTRO";"440710";"4473658";"40.411422452721546";"-3.6988110198857145";"913 690 620";"";"mdoantonmartin@hotmail.com";"/contenido/entidadesYorganismos/Comercios/Mercados"
12426;"Mercado municipal de Argüelles";"A medio camino entre la agitación de calle Princesa y la paz casi forestal del Parque del Oeste, en el cruce de Tutor con Altamirano, está el Mercado de Arg&amp;uuml;elles. Abrió sus puertas en 1949 y, en 2011, después de una exhaustiva remodelación, se convirtió en el mercado ordenado, racional, práctico y accesible que hoy conocemos. Perfectamente insertado en el trazado urbanístico del barrio, una cuadrícula de calles alargadas, combina una completa oferta en perecederos con un supermercado de medianas dimensiones y servicios como una costurera, tiendas de ropa y una academia musical. El mercado cuenta incluso con su propia controversia histórica, originada en torno a unos versos de Pablo Neruda: Todo eran grandes voces, sal de mercaderías, aglomeraciones de pan palpitante, mercados de mi barrio de Arg&amp;uuml;elles con su estatua como un tintero pálido entre las merluzas. Tanto si el poeta se refería a un mercado callejero desplegado en el solar sobre el que se edificó el actual como si no fue así, la cuestión es que ahora este es el mercado de Arg&amp;uuml;elles, con sus merluzas y su pan palpitante.";"Mercado:  De lunes a viernes: de 9 a 14 y de 17:30 a 20 horas. Sábado: de 9 a 14 horas.    Supermercado Ahorramás: de lunes a sábado de 9 a 21 horas.";"";"Metro: Arg&amp;uuml;elles (línea 3, 4 y 6). Salida calle Altamirano.  Bus: 1, 21, 44, 74, 82, 83, 132, 133, C, 21";"";"1";"http://www.madrid.es/sites/v/index.jsp?vgnextchannel=bfa48ab43d6bb410VgnVCM100000171f5a0aRCRD&vgnextoid=1235e1635561c010VgnVCM1000000b205a0aRCRD";"ALTAMIRANO";"CALLE";"V";"7";"";"";"";"";"MADRID";"MADRID";"28008";"2";"ARGUELLES";"9";"MONCLOA-ARAVACA";"439107";"4475866";"40.431197427341125";"-3.7179024231789466";"915 443 015";"";"";"/contenido/entidadesYorganismos/Comercios/Mercados"
12405;"Mercado municipal de Bami";"En el Barrio del Carmen, a dos manzanas de la calle Alcalá y entre una hilera de casas de cuatro pisos, está el mercado de Bami, construido en el año 1954. Su exterior luce un característico aspecto industrial, con cubierta en diente de sierra y muros de fábrica de ladrillo. En su interior encontramos, además de una completa oferta de alimentación (frutería, pescadería, carnicería, charcutería, obrador de panadería, y supermercado), un moderno ginmasio.";"Invierno:  De lunes a viernes de 9 a 14 y de 17 a 20 horas. Sábados de 9 a 14 horas.    Verano (de abril a septiembre):  De lunes a viernes de 9 a 14 y de 17:30 a 20:30 horas. Sábados de 9 a 14 horas.";"";"Metro: Carmen (línea 5)  Bus: 38, 106, 110, 146, 210.";"";"1";"http://www.madrid.es/sites/v/index.jsp?vgnextchannel=bfa48ab43d6bb410VgnVCM100000171f5a0aRCRD&vgnextoid=be75e1635561c010VgnVCM1000000b205a0aRCRD";"BAMI";"PLAZA";"V";"32";"";"";"";"";"MADRID";"MADRID";"28017";"1";"VENTAS";"15";"CIUDAD LINEAL";"444410";"4475768";"40.430694913121776";"-3.655377903084208";"914 013 839";"";"";"/contenido/entidadesYorganismos/Comercios/Mercados"
12393;"Mercado municipal de Barceló";"El mercado de Barceló &amp;ndash;a un paso de Malasaña y en el corazón del Madrid más vibrante- suma y sigue. Más de diez mil metros cuadrados de puestos, repartidos en tres plantas, conforman este espacio, doblemente nuevo e integrado en el Centro Polivalente Barceló. Al antiguo edificio -1956- sucede un mercado que es nuevo por dentro y por fuera. La nueva edificación -inaugurada en 2014- ha venido acompañada de una idea nueva: hacer la compra puede o debe ser un placer. Los puestos de comercio tradicional conviven con nuevas iniciativas, que van desde una barbería a una tienda de productos de limpieza ecológicos. El de Barceló es un mercado elevado al cubo -fruta, carne y pescado- o un mercado de tres plantas -verdura, pollo y embutidos- dentro de un cubo gigante. Ahora, el mercado de Barceló dobla la apuesta con Food Gourmet, una isla de los placeres y los sentidos ubicada en la tercera planta y llamada a ser rompeolas del ocio gastronómico en el distrito Centro.";"De lunes a viernes de 9 a 14:30 y de 17:30 a 20:30 horas. Sábados de 9 a 15 horas.";"Dispone de wifi gratuita.";"Metro: Tribunal (líneas 1, 10), Alonso Martínez (4, 5 y 10) y Bilbao (1 y 4)  Bus: 3, 21, 37, 40, 147, 149";"";"1";"http://www.madrid.es/sites/v/index.jsp?vgnextchannel=bfa48ab43d6bb410VgnVCM100000171f5a0aRCRD&vgnextoid=05a5e1635561c010VgnVCM1000000b205a0aRCRD";"BARCELO";"CALLE";"V";"6";"";"";"";"";"MADRID";"MADRID";"28004";"4";"JUSTICIA";"1";"CENTRO";"440683";"4475365";"40.42680707802062";"-3.6992767323438382";"914 475 550";"";"secretario@mercadobarcelo.es";"/contenido/entidadesYorganismos/Comercios/Mercados"
12413;"Mercado municipal de Chamartín";"El mercado de Chamartín lo hacen las bancas y los puestos, las tiendas y locales exteriores, los comerciantes y los clientes y, por encima de todo, el producto. Abierto desde 1962 en la esquina de Potosí con Bolivia, tiene su seña de identidad en la excelencia, más allá del gourmet. El mejor queso del mundo, las setas más jugosas o la pularda más suculenta pasan por aquí. En el mercado de Chamartín, la primera estación del placer consiste en caminar por sus calles y contemplar los mostradores de sus carnicerías, las luminosas pirámides de sus fruterías y las palpitantes cajas de pescados y mariscos. El viaje continúa con la compra misma, que hace efectiva la promesa de un regalo para los sentidos, y ni siquiera termina al salir del edificio, cuya colorida fachada despunta entre la serenidad del barrio de Hispanoamérica.";"Invierno:  De lunes a viernes de 9 a 14 y de 17 a 20 horas. Sábado de 9 a 14 horas.    Verano (julio y agosto):  De lunes a viernes de 9 a 14 y de 17:30 a 20 horas. Sábado de 9 a 14 horas.";"";"Metro: Colombia (líneas 8, 9)  Bus: 7, 11, 14, 16, 29, 40, 51, 52, 87";"";"1";"http://www.madrid.es/sites/v/index.jsp?vgnextchannel=bfa48ab43d6bb410VgnVCM100000171f5a0aRCRD&vgnextoid=5bc5e1635561c010VgnVCM1000000b205a0aRCRD";"BOLIVIA";"CALLE";"V";"9";"";"";"";"";"MADRID";"MADRID";"28016";"4";"HISPANOAMERICA";"5";"CHAMARTIN";"442509";"4478737";"40.457311867437326";"-3.678056977192461";"914 575 350";"";"mercadodechamartin@mercadodechamartin.com";"/contenido/entidadesYorganismos/Comercios/Mercados"
12422;"Mercado municipal de Chamberí";"En el mercado de Chamberí, la Corte del Faraón hace esquina con la Rosa del azafrán, y los carabineros se cruzan con los ajos de Pedroñeras y con las sacas de alubias verdinas. Lo primero se explica porque las calles tienen nombre de zarzuela, y lo segundo porque la amplia oferta de productos frescos abarca un amplio espectro que va desde la quesería nacional e internacional a las carnes selectas o al pescado más escogido, sin descuidar los productos de la huerta y las aves de corral. Pero, además, en el mercado de Chamberí, al esparcimiento le han dado un nombre, La Chispería, que hace alusión a los antiguos chisperos o empleados de las herrerías que abundaban por la zona. Bares y tascas se agrupan en un espacio propio, dentro de la única y diáfana planta, y ensanchan los límites del tiempo -horario ampliado- y, también, los de la cocina de mercado.";"Horario mercado:  De lunes a viernes: de 9:30 a 14:30 y de 17:30 a 20:30 horas. Sábado: de 9:30 a 14:30 horas.    Horario La Chispería:  Lunes: Cerrado. De martes a jueves: de 12:30 a 24 horas. Viernes y sábado: de 12:30 a 2 horas. Domingo: de 12:30 a 17:30 horas.";"";"Metro: Iglesia (línea 1) , Alonso Cano (línea 7).  Bus: 5, 12, 16, 61.";"";"1";"http://www.madrid.es/sites/v/index.jsp?vgnextchannel=bfa48ab43d6bb410VgnVCM100000171f5a0aRCRD&vgnextoid=a1f5e1635561c010VgnVCM1000000b205a0aRCRD";"ALONSO CANO";"CALLE";"V";"10";"";"";"";"";"MADRID";"MADRID";"28010";"4";"ALMAGRO";"7";"CHAMBERI";"440811";"4476407";"40.43620300971715";"-3.6978649027841857";"914 469 574";"";"mercadodechamberi@gmail.com.";"/contenido/entidadesYorganismos/Comercios/Mercados"
12414;"Mercado municipal de Diego de León";"En el mercado de Diego de León hay sitio para todos. Los jefes de cocina de los restaurantes de la zona, los oficinistas y los clientes del vecindario acuden al mercado con un mismo objetivo: la cercanía y la confianza con el comerciante. Forma parte del tejido comercial del barrio y lo abastece de los frescos imprescindibles -carnes y pescados, frutas y verduras, aves y huevos- desde 1939. Conserva algunos rótulos originales de singular belleza. En el mercado de Diego de León lo esencial convive con lo fundamental: es el sitio en el que comprar una caja de botellas de vino o un kilo de peras Conferencia, el sitio en el que encargar el tapizado de un sofá o enmarcar un cuadro, el sitio en el que lo gourmet se convierte en lo natural. Público fiel de toda la vida. Gente del barrio y alrededores. Los comerciantes conocen a sus clientes.";"Invierno:  De lunes a viernes de 9 a 14 y de 17 a 20 horas. Sábado de 9 a 14 horas.    Verano:  De lunes a viernes de 9 a 14 y de 17:30 a 20:30 horas. Sábado de 9 a 14 horas.";"Dispone de wifi gratuita";"Metro: Nuñez de Balboa (líneas 5, 9)  Bus: 9, 16, 19, 51, 61, 74, C.";"";"1";"http://www.madrid.es/sites/v/index.jsp?vgnextchannel=bfa48ab43d6bb410VgnVCM100000171f5a0aRCRD&vgnextoid=f716e1635561c010VgnVCM1000000b205a0aRCRD";"DIEGO DE LEON";"CALLE";"V";"26";"";"";"";"";"MADRID";"MADRID";"28006";"6";"CASTELLANA";"4";"SALAMANCA";"442116";"4476236";"40.43475434372196";"-3.6824756273454726";"917 030 405";"";"gerente@mercadodiegodeleon.es";"/contenido/entidadesYorganismos/Comercios/Mercados"
12433;"Mercado municipal de Doña Carlota";"En el corazón del barrio de Doña Carlota, desde hace más de cincuenta años, late un mercado que ha sabido evolucionar con el paso del tiempo. Tras una remodelación, en 2015, el mercado de Doña Carlota se ha llenado de luz y los accesos se han hecho fáciles (rampa y ascensor). A la tradicional y completa oferta en alimentación, agrupada en la planta baja, hay que sumar una amplia gama de servicios que, desde las tiendas exteriores y desde un supermercado ubicado en la primera planta, ofrecen lo que un barrio necesita. Cuenta con salas para exposiciones y espacios comunes que, sobre todo durante el fin de semana, revitalizan el aire de la plaza con degustaciones y actuaciones en directo. El mercado de Doña Carlota es un pedazo de historia, un trozo de un Madrid inconfundible que sirvió para rodar algunas escenas de la película Volver, de Pedro Almodóvar: Penélope Cruz compra fruta en un puesto y, en una ferretería, se hace con el material necesario para deshacerse del cadáver de su marido. Entre tanto, la vida sigue en el mercado de Doña Carlota.";"Invierno   De lunes a viernes: de 9 a 14 y de 17 a 20 horas Sábados: de 9 a 14 horas   Verano (desde el primer lunes de marzo hasta finales de septiembre)  De lunes a viernes: de 9 a 14 y de 17:30 a 20:30 horas Sábado: de 9 a 14 horas";"";"Bus: 8, 113, 141";"";"1";"http://www.madrid.es/sites/v/index.jsp?vgnextchannel=bfa48ab43d6bb410VgnVCM100000171f5a0aRCRD&vgnextoid=4e36e1635561c010VgnVCM1000000b205a0aRCRD";"DOCTOR LOZANO";"CALLE";"V";"16";"";"";"";"";"MADRID";"MADRID";"28038";"6";"NUMANCIA";"13";"PUENTE DE VALLECAS";"444016";"4472712";"40.4031383496021";"-3.6597537009742824";"915 522 940";"";"mercado.doñacarlota@ono.com";"/contenido/entidadesYorganismos/Comercios/Mercados"
12400;"Mercado municipal de Guillermo de Osma";"Abierto al público en 1970 y doblemente remodelado en el presente siglo, el mercado Guillermo de Osma es una plaza de abastos en un barrio donde abundan las plazas, al costado de la calle Embajadores. Es el sitio donde los vecinos de La Arganzuela encuentran lo necesario para llenar la nevera y cubrir la mesa. Hay decenas de puestos entre carnicerías y verdulerías, fruterías y pescaderías, pollerías, salchicherías y casquerías, cuya oferta se completa con un supermercado de medianas dimensiones. Los accesos son cómodos y la disposición de los locales, repartidos en islas y calles, facilita el tránsito de clientes. El mercado Guillermo de Osma es también un centro de servicios, un lugar donde afilar un cuchillo, arreglar una cremallera o reparar un reloj.";"Mercado tradicional: Lunes a viernes de 9 a 14 y de 17 a 20 horas. Sábados y visperas de festivos de 9 a 14:30 horas.  Mercado gastronómico: Lunes a jueves de 9 a 22 horas. Viernes y visperas de festivos de 9 a 24 horas. Domingos y festivos 11:30 a 17:30 horas.";"Zona Wifi";"Metro: Legazpi (líneas 3 y 6)   Bus: 6 , 8 , 18 , 19 , 45 , 47 , 59 , 62 , 76 , 78 , 85 , 86 , 148 , 247.";"";"1";"http://www.madrid.es/sites/v/index.jsp?vgnextchannel=bfa48ab43d6bb410VgnVCM100000171f5a0aRCRD&vgnextoid=ea86e1635561c010VgnVCM1000000b205a0aRCRD";"MIGUEL ARREDONDO";"CALLE";"V";"4";"";"";"";"";"MADRID";"MADRID";"28045";"3";"CHOPERA";"2";"ARGANZUELA";"441042";"4472034";"40.3949437306698";"-3.6960129848486107";"91 490 47 53";"";"guillermodeosma@ryaresidencias.es";"/contenido/entidadesYorganismos/Comercios/Mercados"
12427;"Mercado municipal de Guzmán el Bueno";"En el mercado de Guzmán el Bueno, que en realidad está en la calle Andrés Mellado, se hace la compra y se hacen muchas otras cosas. El mercado, que se inauguró en 1951, abastece de productos frescos al área de Gaztambide, en el distrito de Chamberí, y además funciona como parte viva de un barrio donde el comercio de cercanía es una seña de identidad. Más allá de los abastos, el mercado se confunde con el tejido social y cede sus instalaciones para actuaciones y degustaciones, rutas gastronómicas y visitas escolares. Un colegial observa las evoluciones de un cangrejo vivo en el mostrador de una pescadería, un chulapo y una chulapona bailan un chotis alrededor de un ladrillo y, al fondo, un carnicero despieza una ternera de Ávila. Revestimientos de granito, mostradores de aluminio, buena iluminación y accesibilidad universal son el resultado de una reforma, acometida en 2005, que agrupó los puestos en la planta baja y ubicó un supermercado de la cadena Ahorramás en la primera.";"Invierno:   De lunes a viernes: de 9 a 20:30 horas. Sábado: de 9 a 14 horas.     Verano:    De lunes a viernes de 9 a 20:30 horas.    Sábado: de 9 a 14 horas.     Supermercado Ahorramás:  De lunes a sábado: de 9 a 21 horas";"";"Metro: Moncloa (línea 3, 6).  Bus: 1 , 2 , 16 , 41, 44, 46, 61, 82, 83, 132, 133, 202, C1, C2, G.";"";"1";"http://www.madrid.es/sites/v/index.jsp?vgnextchannel=bfa48ab43d6bb410VgnVCM100000171f5a0aRCRD&vgnextoid=87d6e1635561c010VgnVCM1000000b205a0aRCRD";"ANDRES MELLADO";"CALLE";"V";"43";"";"";"";"";"MADRID";"MADRID";"28015";"1";"GAZTAMBIDE";"7";"CHAMBERI";"439398";"4476280";"40.43495717590039";"-3.7145114819530365";"915 434 102";"";"mguzmaneb@gmail.com";"/contenido/entidadesYorganismos/Comercios/Mercados"
4824028;"Mercado municipal de Ibiza";"El mercado de Ibiza no es una isla y forma parte del tejido comercial del barrio, y del quehacer diario de sus vecinos desde 1954. Situado en la confluencia de Ibiza con la calle Lope de Rueda y a dos pasos del parque del Retiro, es el lugar idóneo para llenar la cesta de la compra o una canasta para el picnic. En 2010 se renovaron totalmente sus instalaciones, lo cual ha facilitado los accesos y ha llenado de luz el espacio. Los puestos del mercado tradicional, agrupados en la planta de arriba, surten de productos frescos -carne y pescado, frutas y verduras, pollería, panadería y bollería- y de chacinas de calidad, variantes y ultramarinos tanto a vecinos del área de Retiro como a los numerosos restaurantes y tascas de la zona. La oferta se completa con un supermercado ubicado en la planta baja.";"Invierno:  De lunes a viernes de 9 a 14 y de 17 a 20 horas. Sábados de 9 a 14 horas.    Verano (mayo a octubre, ambos inclusive):  De lunes a viernes de 9 a 14 y de 17:30 a 20:30 horas. Sábados de 9 a 14 horas.    Supermercado Ahorramas: de lunes a sábado de 9 a 21 horas.";"";"Metro: Ibiza (línea 9).  Bus: 15, 20, 26, 61, 63, 152, 202, 215, C.";"";"1";"http://www.madrid.es/sites/v/index.jsp?vgnextchannel=bfa48ab43d6bb410VgnVCM100000171f5a0aRCRD&vgnextoid=9c5f5f962d888110VgnVCM2000000c205a0aRCRD";"IBIZA";"CALLE";"V";"8";"";"";"";"";"MADRID";"MADRID";"28009";"4";"IBIZA";"3";"RETIRO";"442533";"4474392";"40.41817157699025";"-3.677392762224429";"914 091 800";"";"mcdoibizaenmadrid@yahoo.es";"/contenido/entidadesYorganismos/Comercios/Mercados"
12431;"Mercado municipal de Jesús del Gran Poder";"El mercado de Jesús del Gran Poder está a cuatro pasos del río Manzanares, en el radio de acción del centro cultural El Matadero y en pleno corazón de Usera y rodeado de calles donde vibra el comercio y la actividad. El resultado de este cruce de corrientes de energía es un mercado diferente donde no falta lo imprescindible y hay ocasión para sorprenderse. La oferta en productos frescos se satisface con carnicerías, fruterías, pollerías, charcuterías, panaderías y pescaderías en las que reina la abundancia, y se complementa con una mediana superficie. En el camino entre un puesto y otro, en lugares a veces insospechados, el cliente se encontrará con intervenciones artísticas -enmarcadas en la Exposición Luminaria-, con talleres de cocina o con una venta solidaria de libros de ocasión.";"Invierno:  De lunes a viernes: de 9 a 14 y de 17 a 20 horas. Sábados: de 9 a 14:30 horas.    Verano:  De lunes a viernes: de 9 a 14 y de 17:30 a 20:30 horas. Sábados: de 9 a 14:30 horas.    Supermercado DIA:  De lunes a sábado: de 9 a 14 y de 17:30 a 20:30 horas. Sábados: de 9 a 14 y de 17  a 20 horas.";"";"Metro: Usera (línea 6), Almendrales (línea 3)  Bus: 6, 18, 22, 23, 47, 59, 76, 78, 79, 85, 86, 247";"";"0";"http://www.madrid.es/sites/v/index.jsp?vgnextchannel=bfa48ab43d6bb410VgnVCM100000171f5a0aRCRD&vgnextoid=2427e1635561c010VgnVCM1000000b205a0aRCRD";"JESUS DEL GRAN PODER";"CALLE";"V";"42";"";"";"";"";"MADRID";"MADRID";"28026";"4";"ALMENDRALES";"12";"USERA";"440494";"4470881";"40.38639943136542";"-3.7010971746900325";"915 001 202";"";"";"/contenido/entidadesYorganismos/Comercios/Mercados"
12425;"Mercado municipal de La Guindalera";"El mercado de La Guindalera es una plaza de abastos que se asoma a otra plaza, la de San Cayetano, y da de comer a todo un barrio. Setenta años después de su inauguración, y una vez reformado y rehabilitado y con su característica fachada en azul, el mercado combina la tradicional oferta de productos frescos e imprescindibles con otros proyectos que marcan la diferencia, ya sea una tienda de lanas o una chocoteca, un herbolario o un negocio de sushi fusionado con cocina peruana. El mercado, y el propio barrio, toman el nombre de una antigua plantación de guindos y hunde sus raíces en los tiempos en los que Madrid y su ensanche eran zona de huerta. Las guindas siguen siendo parte de la imagen corporativa del mercado, que ha encontrado en las actividades más diversas una seña de identidad y una forma de conectar con el entorno: un pasacalles o una coral, una compañía de bailes goyescos o una degustación de repostería. Además de los puestos dedicados a llenar la nevera y la despensa de los vecinos de La Guindalera y alrededores, en sus pasillos y en el exterior se distribuyen otros comercios donde se vende ropa y complementos, se arreglan zapatos y se copian llaves, así como una cafetería.";"Invierno:  De lunes a viernes: de 9 a 14 y de 17 a 20 horas. Sábado: de 9 a 14 horas.    Verano (de junio a octubre, ambos inclusive):  De lunes a viernes: de 9 a 14 y de 17:30 a 20:30 horas. Sábado: de 9 a 14 horas.";"Dispone de acceso para  personas con movilidad y baños adaptados.";"Metro: Diego de León (líneas 4, 5, 6). Salida calle Eraso.  Bus: 1, 12, 26, 43, 56, 72, 73, 74, 48, C1, C2.";"";"1";"http://www.madrid.es/sites/v/index.jsp?vgnextchannel=bfa48ab43d6bb410VgnVCM100000171f5a0aRCRD&vgnextoid=31b6e1635561c010VgnVCM1000000b205a0aRCRD";"ERASO";"CALLE";"V";"14";"";"";"";"";"MADRID";"MADRID";"28028";"4";"GUINDALERA";"4";"SALAMANCA";"443083";"4476157";"40.43410047219345";"-3.671056299540891";"917 257 443";"";"mercadodelaguindalera@hotmail.com";"/contenido/entidadesYorganismos/Comercios/Mercados"
